"Straight Outta Compton | Ice Cube Meets the Crenshaw Mafia","Universal Pictures All-Access","9 months","10 minutes, 1 second","8,209,033 views"
"Man In the Crowed Yelled &quot;Kick him in the dick&quot; during UFC match","J-Guide Entertainment","3 years","13 seconds","1,552,049 views"
"Fresh Prince of Bel Air: Screams and Funny Moments (S05) P1","Bruceolini and his big weenie","9 years","10 minutes, 7 seconds","1,117,775 views"
"Windmill destructed in storm","sneaker65","12 years","30 seconds","8,569,106 views"
"WHEN LILY &amp; MICHAEL REEVES WERE ONLY FRIENDS","Onliner","4 months","13 minutes, 40 seconds","443,050 views"
"Gladiator (8/8) Movie CLIP - Maximus Kills Commodus (2000) HD","Movieclips","8 years","2 minutes, 43 seconds","2,062,112 views"
"Among Us but my team mindgame themselves...","Sykkuno","3 hours","12 minutes, 51 seconds","81,277 views"
"Kingdom of Heaven - Jerusalem goes to War","Credenzio Studios","2 years","2 minutes, 17 seconds","407,156 views"
"It&#39;s Always Sunny in Philadelphia - Mac and Charlie beat up kids","Cole J","1 year","2 minutes, 7 seconds","2,424,090 views"
"A pound of sodium metal in the river","EatsTooMuchJam","6 years","28 seconds","4,455,514 views"
"The Fresh Prince of Bel-Air  Bloopers  Part 2","Jessica B","12 years","3 minutes, 22 seconds","1,633,869 views"
"How Netflix&#39;s &#39;Extraction&#39; Filmed A 12-Minute Fight Scene To Look Like One Take | Movies Insider","Insider","4 months","9 minutes, 48 seconds","4,248,420 views"
"President Trump tweets video calling COVID-19 diagnosis a “blessing”","CBS This Morning","15 hours","2 minutes, 50 seconds","115,903 views"
"Anderson Cooper: Is Trump kidding himself about Covid-19 status?","CNN","2 hours","8 minutes, 32 seconds","72,621 views"
"Here’s everyone who’s tested positive for COVID-19 in connection to the White House","Good Morning America","3 hours","2 minutes, 35 seconds","22,565 views"
"President Trump declares he is cured of COVID-19 a week after testing positive | WNT","ABC News","4 hours","4 minutes, 1 second","86,352 views"
"COVID-19 Clusters in NYC: Protests Continue As New Shutdowns Begin | NBC New York Coronavirus Update","NBC New York","2 hours","5 minutes, 13 seconds","1,784 views"
"Regeneron asks FDA for emergency approval of COVID-19 antibody treatment given to Trump","Click On Detroit | Local 4 | WDIV","5 hours","2 minutes, 1 second","3,173 views"
"At least two Miami students test positive for COVID-19 during first week back in school","Miami Herald","5 hours","1 minute, 23 seconds","386 views"
"SNL Cancels Morgan Wallen&#39;s Musical Performance For Breaching COVID-19 Protocols","Entertainment Tonight","3 hours","2 minutes, 26 seconds","11,652 views"
"Trump Says It’s ‘A Blessing From God’ That He Caught COVID-19 | TODAY","TODAY","15 hours","1 minute, 16 seconds","11,277 views"
"Russell Wilson on positive COVID-19 tests in the NFL | DangerTalk","ESPN","2 hours","5 minutes, 25 seconds","3,120 views"
"Regeneron is much greater than this Covid-19 story: Analyst","CNBC Television","8 hours","3 minutes, 55 seconds","5,097 views"
"&quot;Saturday Night Live&quot; cancels Morgan Wallen performance after singer breaks COVID-19 protocols","CBS This Morning","14 hours","1 minute, 8 seconds","25,427 views"
"DiCaprio: Couldn&#39;t Believe &#39;Wolf&#39; Belfort Survived","Bloomberg QuickTake","6 years","2 minutes, 51 seconds","3,132,786 views"
"THE MOST INSPIRING MOMENTS OF  RESPECT IN UFC","BOS batusai TV","1 year","4 minutes, 36 seconds","1,583,604 views"
"Opel Corsa C 60HP | TOP SPEED ON GERMAN NO LIMIT AUTOBAHN | 170 km/h","Driving is my Passion","1 month","6 minutes 30 seconds","1,198,270 views"
"When someone plays Sweet Caroline in a Boston Subway","Bryce the Chihuahua","2 years","1 minute, 1 second","6,979,774 views"
"Nakonechnyy Pavlo - 1010.5 kg @ 21 y/o - EPF Classic Championships 2018 - 2nd Place 120+ Jr","Strength Central","1 year","6 minutes, 37 seconds","906,187 views"
"2Pac gives a powerful speech in court in All Eyez on Me","Dr. Dre","3 years","2 minutes, 47 seconds","5,849,409 views"
"Antique and Rusty Wrench Restoration","LADB Restoration","5 months","14 minutes, 38 seconds","6,470,320 views"
"If Car Commercials Were Honest - Honest Ads (BMW Ford Toyota Chevrolet Parody)","Cracked","5 years","3 minutes, 3 seconds","6,416,398 views"
